{
  "schema_version": 1,
  "ticker": "KO",
  "period": "2025-FY",
  "growth": [
    {
      "metric_id": "revenue_growth",
      "name": "Gelir Büyümesi",
      "value": 1.9,
      "unit": "percent",
      "period": "2025-FY",
      "comparison_value": null,
      "comparison_period": "2024-FY",
      "change": null,
      "change_unit": "not_applicable",
      "data_type": "derived",
      "formula_id": "revenue_growth",
      "formula_version": 1,
      "formula_inputs": [
        "direct:revenue_total"
      ],
      "formula_description": "Year-over-year total revenue growth."
    },
    {
      "metric_id": "gross_profit_growth",
      "name": "Brüt Kâr Büyümesi",
      "value": 2.8,
      "unit": "percent",
      "period": "2025-FY",
      "comparison_value": null,
      "comparison_period": "2024-FY",
      "change": null,
      "change_unit": "not_applicable",
      "data_type": "derived",
      "formula_id": "gross_profit_growth",
      "formula_version": 1,
      "formula_inputs": [
        "direct:gross_profit"
      ],
      "formula_description": "Year-over-year gross profit growth."
    },
    {
      "metric_id": "operating_profit_growth",
      "name": "Faaliyet Kâr Büyümesi",
      "value": 37.7,
      "unit": "percent",
      "period": "2025-FY",
      "comparison_value": null,
      "comparison_period": "2024-FY",
      "change": null,
      "change_unit": "not_applicable",
      "data_type": "derived",
      "formula_id": "operating_profit_growth",
      "formula_version": 1,
      "formula_inputs": [
        "direct:operating_profit"
      ],
      "formula_description": "Year-over-year growth of IFRS operating profit including investment income/expense and equity-method share."
    },
    {
      "metric_id": "net_profit_growth",
      "name": "Net Kâr Büyümesi",
      "value": 23.4,
      "unit": "percent",
      "period": "2025-FY",
      "comparison_value": null,
      "comparison_period": "2024-FY",
      "change": null,
      "change_unit": "not_applicable",
      "data_type": "derived",
      "formula_id": "net_profit_growth",
      "formula_version": 1,
      "formula_inputs": [
        "direct:net_profit_for_period"
      ],
      "formula_description": "Year-over-year net profit growth; returns not_comparable when the comparison period was a loss (sign transition, not ordinary growth)."
    },
    {
      "metric_id": "operating_cash_flow_growth",
      "name": "Faaliyet Nakit Akışı Büyümesi",
      "value": 8.9,
      "unit": "percent",
      "period": "2025-FY",
      "comparison_value": null,
      "comparison_period": "2024-FY",
      "change": null,
      "change_unit": "not_applicable",
      "data_type": "derived",
      "formula_id": "operating_cash_flow_growth",
      "formula_version": 1,
      "formula_inputs": [
        "direct:cf_net_operating_activities"
      ],
      "formula_description": "Year-over-year net operating cash flow growth."
    }
  ],
  "margins": [
    {
      "metric_id": "gross_margin",
      "name": "Brüt Marjı",
      "value": 61.63,
      "unit": "percent",
      "period": "2025-FY",
      "comparison_value": 61.06,
      "comparison_period": "2024-FY",
      "change": 0.57,
      "change_unit": "percentage_point",
      "data_type": "derived",
      "formula_id": "gross_margin",
      "formula_version": 1,
      "formula_inputs": [
        "direct:gross_profit",
        "direct:revenue_total"
      ],
      "formula_description": "Gross profit as a percentage of total revenue."
    },
    {
      "metric_id": "operating_margin_pre_investment",
      "name": "Faaliyet Marjı Pre Yatırım",
      "value": 28.71,
      "unit": "percent",
      "period": "2025-FY",
      "comparison_value": 21.23,
      "comparison_period": "2024-FY",
      "change": 7.48,
      "change_unit": "percentage_point",
      "data_type": "derived",
      "formula_id": "operating_margin_pre_investment",
      "formula_version": 1,
      "formula_inputs": [
        "direct:operating_profit_before_investment_activities",
        "direct:revenue_total"
      ],
      "formula_description": "Operating margin before investment income/expense and equity-method share (core operating activity only)."
    },
    {
      "metric_id": "operating_margin",
      "name": "Faaliyet Marjı",
      "value": 28.71,
      "unit": "percent",
      "period": "2025-FY",
      "comparison_value": 21.23,
      "comparison_period": "2024-FY",
      "change": 7.48,
      "change_unit": "percentage_point",
      "data_type": "derived",
      "formula_id": "operating_margin",
      "formula_version": 1,
      "formula_inputs": [
        "direct:operating_profit",
        "direct:revenue_total"
      ],
      "formula_description": "IFRS operating profit margin, including investment income/expense and equity-method share."
    },
    {
      "metric_id": "net_margin",
      "name": "Net Marjı",
      "value": 27.4,
      "unit": "percent",
      "period": "2025-FY",
      "comparison_value": 22.63,
      "comparison_period": "2024-FY",
      "change": 4.77,
      "change_unit": "percentage_point",
      "data_type": "derived",
      "formula_id": "net_margin",
      "formula_version": 1,
      "formula_inputs": [
        "direct:net_profit_for_period",
        "direct:revenue_total"
      ],
      "formula_description": "Net profit as a percentage of total revenue."
    },
    {
      "metric_id": "operating_cash_flow_margin",
      "name": "Faaliyet Nakit Akışı Marjı",
      "value": 15.45,
      "unit": "percent",
      "period": "2025-FY",
      "comparison_value": 14.46,
      "comparison_period": "2024-FY",
      "change": 0.99,
      "change_unit": "percentage_point",
      "data_type": "derived",
      "formula_id": "operating_cash_flow_margin",
      "formula_version": 1,
      "formula_inputs": [
        "direct:cf_net_operating_activities",
        "direct:revenue_total"
      ],
      "formula_description": "Net operating cash flow as a percentage of total revenue."
    },
    {
      "metric_id": "free_cash_flow_margin",
      "name": "Serbest Nakit Akışı Marjı",
      "value": 11.05,
      "unit": "percent",
      "period": "2025-FY",
      "comparison_value": 10.07,
      "comparison_period": "2024-FY",
      "change": 0.98,
      "change_unit": "percentage_point",
      "data_type": "derived",
      "formula_id": "free_cash_flow_margin",
      "formula_version": 1,
      "formula_inputs": [
        "derived:free_cash_flow",
        "direct:revenue_total"
      ],
      "formula_description": "Standard free cash flow as a percentage of total revenue."
    }
  ],
  "liquidity": [
    {
      "metric_id": "current_ratio",
      "name": "Cari Oranı",
      "value": 1.459,
      "unit": "ratio",
      "period": "2025-FY",
      "comparison_value": 1.03,
      "comparison_period": "2024-FY",
      "change": 0.429,
      "change_unit": "ratio_points",
      "data_type": "derived",
      "formula_id": "current_ratio",
      "formula_version": 1,
      "formula_inputs": [
        "direct:total_current_assets",
        "direct:total_current_liabilities"
      ],
      "formula_description": "Total current assets divided by total current liabilities."
    },
    {
      "metric_id": "cash_and_st_investments_to_current_liabilities",
      "name": "Nakit ve Kısa Vadeli Yatırımlar To Cari Yükümlülükler",
      "value": 0.652,
      "unit": "ratio",
      "period": "2025-FY",
      "comparison_value": 0.509,
      "comparison_period": "2024-FY",
      "change": 0.143,
      "change_unit": "ratio_points",
      "data_type": "derived",
      "formula_id": "cash_and_st_investments_to_current_liabilities",
      "formula_version": 1,
      "formula_inputs": [
        "direct:cash_and_equivalents",
        "direct:financial_investments_current",
        "direct:total_current_liabilities"
      ],
      "formula_description": "Cash and short-term financial investments divided by total current liabilities."
    },
    {
      "metric_id": "net_working_capital",
      "name": "Net İşletme Sermayesi",
      "value": 9763.0,
      "unit": "million_usd",
      "period": "2025-FY",
      "comparison_value": 748.0,
      "comparison_period": "2024-FY",
      "change": 9015.0,
      "change_unit": "currency_points",
      "data_type": "derived",
      "formula_id": "net_working_capital",
      "formula_version": 1,
      "formula_inputs": [
        "direct:total_current_assets",
        "direct:total_current_liabilities"
      ],
      "formula_description": "Total current assets minus total current liabilities."
    }
  ],
  "leverage": [
    {
      "metric_id": "financial_debt",
      "name": "Finansal Borç",
      "value": 45492.0,
      "unit": "million_usd",
      "period": "2025-FY",
      "comparison_value": 44522.0,
      "comparison_period": "2024-FY",
      "change": 970.0,
      "change_unit": "currency_points",
      "data_type": "derived",
      "formula_id": "financial_debt",
      "formula_version": 1,
      "formula_inputs": [
        "direct:borrowings_short_term",
        "direct:borrowings_long_term_current_portion",
        "direct:borrowings_long_term"
      ],
      "formula_description": "Interest-bearing financial debt, excluding lease liabilities."
    },
    {
      "metric_id": "lease_liability_total",
      "name": "Kira Yükümlülük Toplam",
      "value": 1722.0,
      "unit": "million_usd",
      "period": "2025-FY",
      "comparison_value": 1213.0,
      "comparison_period": "2024-FY",
      "change": 509.0,
      "change_unit": "currency_points",
      "data_type": "derived",
      "formula_id": "lease_liability_total",
      "formula_version": 1,
      "formula_inputs": [
        "direct:lease_liabilities_short_term",
        "direct:lease_liabilities_long_term"
      ],
      "formula_description": "Total lease liabilities (current plus non-current)."
    },
    {
      "metric_id": "total_financial_liability_incl_lease",
      "name": "Toplam Finansal Yükümlülük Dahil Kira",